{
  "id": "process-fdee92a0-5a2b-48be-8696-245eff49aa07",
  "type": "PROCESS",
  "name": "variable-mapping-with-loop",
  "extensions": {
    "Process_N4qkN051N": {
      "constants": {},
      "mappings": {
        "Task_0od1320": {
          "outputs": {
            "processedValue": {
              "type": "variable",
              "value": "output"
            }
          },
          "inputs": {
            "input": {
              "type": "variable",
              "value": "input"
            }
          }
        },
        "Task_125yjke": {
          "outputs": {
            "input": {
              "type": "variable",
              "value": "formInput"
            }
          }
        }
      },
      "properties": {
        "d9ab5d53-3dba-4422-9ba7-b74dc216d1ba": {
          "id": "d9ab5d53-3dba-4422-9ba7-b74dc216d1ba",
          "name": "input",
          "type": "string",
          "value": "",
          "required": false
        },
        "e974d84d-aa76-4acb-903d-97582fe89861": {
          "id": "e974d84d-aa76-4acb-903d-97582fe89861",
          "name": "processedValue",
          "type": "string",
          "value": "",
          "required": false
        }
      },
      "assignments": {
        "Task_125yjke": {
          "type": "identity",
          "assignment": "assignee",
          "id": "Task_125yjke"
        }
      }
    }
  }
}
