{
  "id": "process-db995012-b417-4cea-a981",
  "type": "PROCESS",
  "name": "Message Payload Process",
  "extensions": {
    "Process_hg2itgWRj": {
      "constants": {},
      "mappings": {
        "IntermediateThrowEvent_1kozj3g": {
          "inputs": {
            "my-message-payload": {
              "type": "variable",
              "value": "var1"
            },
            "goodPayload": {
              "type": "variable",
              "value": "var1"
            },
            "wrong-payload": {
              "type": "variable",
              "value": "var1"
            },
            "123abc": {
              "type": "variable",
              "value": "var1"
            }
          }
        }
      },
      "properties": {
        "ca9de08b-2ac7-4e1c-86bb-86e01c71b536": {
          "id": "ca9de08b-2ac7-4e1c-86bb-86e01c71b536",
          "name": "correlationkey",
          "type": "string",
          "value": "test",
          "required": false
        },
        "f829e900-e5f3-4ccb-bcd5-5c29097d7743": {
          "id": "f829e900-e5f3-4ccb-bcd5-5c29097d7743",
          "name": "var1",
          "type": "string",
          "value": "",
          "required": false
        }
      },
      "assignments": {}
    },
    "Process_1mzy483": {
      "constants": {},
      "mappings": {
        "IntermediateThrowEvent_07o1f9u": {
          "outputs": {
            "var1": {
              "type": "variable",
              "value": "my-message-payload"
            }
          }
        }
      },
      "properties": {
        "d649ed6b-d40c-44f3-a9bd-907f01c759c4": {
          "id": "d649ed6b-d40c-44f3-a9bd-907f01c759c4",
          "name": "correlationkey",
          "type": "string",
          "value": "test",
          "required": false
        },
        "44cb1052-72fc-4cf0-aa48-8dd589567e60": {
          "id": "44cb1052-72fc-4cf0-aa48-8dd589567e60",
          "name": "var1",
          "type": "string",
          "value": "",
          "required": false
        }
      },
      "assignments": {}
    }
  }
}
