{
  "id": "process-x",
  "name": "p2",
  "extensions": {
    "properties": {
      "4d4475c9-4150-425b-8a29-1c3532b49215": {
        "id": "4d4475c9-4150-425b-8a29-1c3532b49215",
        "name": "name1",
        "type": "string",
        "value": "",
        "required": false
      },
      "1618c208-75f7-44a1-82c3-23ca34785306": {
        "id": "1618c208-75f7-44a1-82c3-23ca34785306",
        "name": "name2",
        "type": "string",
        "value": "",
        "required": false
      }
    }
  },
  "type": "PROCESS"
}